ingredient_text,allergens
"corn syrup, treated with sulfites, guar gum, vitamin A, thiamine, dried fruits with sulfites, paprika extract, sodium sulfite, magnesium carbonate, natural colors",sulphites
"preservatives, yeast, natural flavors, shrimp paste, modified starch",shellfish
"glucose (as stabilizer), lupin seeds, monkey nuts, lupini, vitamin D, beer nuts, thiamine, ground nut oil, potassium chloride, maltodextrin, lupini beans","lupin,peanut"
"sodium metabisulfite, soy protein, dried fruits with sulfites, lecithin (as stabilizer), crawfish, salt, citric acid, guar gum, natural flavors, preserved with sulfites, niacin, thiamine","shellfish,soy,sulphites"
"salt, folate, (may be present: soy, tree_nuts), palm oil","soy,tree_nuts"
"INGREDIENTS: mono and diglycerides, whey, preservatives, milk, sodium bicarbonate, corn starch, artificial flavors, egg, meringue, annatto. CONTAINS dairy. MAY CONTAIN fish, wheat DUE TO SHARED EQUIPMENT","dairy,egg,fish,wheat"
"soy, ghee, folate, water, soya, tofu, rice flour, whey, vitamin E, mustard oil, mustard","dairy,mustard,soy"
"salt, skimmed milk powder, mustard powder, magnesium carbonate, mustard, milk solids, artificial flavors","dairy,mustard"
"natural flavors, almond, sodium metabisulfite, glucose, vitamin A, annatto, vitamin D (for color), thiamine (for texture), corn syrup (for texture)","sulphites,tree_nuts"
"paprika extract, pine nut, artificial flavors, potassium chloride, corn starch, baking powder, water, fructose, pistachio, lobster","shellfish,tree_nuts"
"invert sugar, pecan, corn syrup, glucose, almond, magnesium carbonate, natural flavors, yeast, xanthan gum",tree_nuts
"vitamin A, vitamin D, artificial flavors",none
"niacin, tapioca starch, (manufactured on equipment that also processes shellfish), thiamine, potato starch, calcium carbonate, invert sugar (for color)",shellfish
"INGREDIENTS: lecithin, fish powder, maltodextrin, corn syrup, palm oil, surimi, carrageenan, marzipan, salmon, xanthan gum. CONTAINS fish. MAY CONTAIN peanut, dairy, sesame DUE TO SHARED EQUIPMENT","dairy,fish,peanut,sesame,tree_nuts"
"dextrose, sodium bicarbonate, beta carotene, egg lecithin, rice flour, crawfish, magnesium carbonate, prawn, egg, carrageenan, preservatives, shrimp paste, natural flavors","egg,shellfish"
"riboflavin, citric acid (for color), magnesium carbonate, mollusc extract, lupini beans, lupine","lupin,molluscs"
"INGREDIENTS: vegetable oil (as preservative), carrageenan, paprika extract, yeast, artificial flavors, sunflower oil, water, corn syrup",none
"carrageenan, yeast, sugar, abalone, clam juice, lupin, citric acid, annatto, mussel, sulfites","lupin,molluscs,sulphites"
"lecithin, carrageenan, thiamine (for texture), lactic acid (for texture), modified starch, sunflower oil",none
"INGREDIENTS: albumin, potassium chloride, natural colors, salt, natural flavors, magnesium carbonate, malt, dried egg. CONTAINS egg, wheat. MAY CONTAIN soy DUE TO SHARED EQUIPMENT","egg,soy,wheat"
"guar gum (as preservative), turmeric, vitamin D, wheat starch, hydrolyzed wheat protein, egg, pasteurized egg, annatto, magnesium carbonate, meringue, calcium carbonate","egg,wheat"
"INGREDIENTS: corn starch, sodium bicarbonate, carrageenan (for color), thiamine, mono and diglycerides, salt, dextrose, natural colors",none
"INGREDIENTS: soy protein, vitamin A, potassium chloride, modified starch, sunflower oil, dextrose (for color), calcium carbonate. CONTAINS soy",soy
"canola oil, corn starch, annatto, arachis oil, vegetable oil, almond milk, mono and diglycerides, invert sugar (as stabilizer), niacin, chestnut, turmeric, (produced in a facility that handles wheat), peanut protein","peanut,tree_nuts,wheat"
"crayfish, vitamin E, prawn, lecithin (as stabilizer), corn syrup, natural colors, shellfish extract, paprika extract",shellfish
"sesame oil, tamari, palm oil (for texture), natto, gingelly oil, sesame, edamame, baking powder, guar gum","sesame,soy"
"potassium chloride, lactic acid, glucose (as stabilizer), rice flour, xanthan gum, preservatives",none
"fructose, natural flavors, thiamine",none
"beta carotene, meringue, xanthan gum, canola oil, mustard powder, mustard flour, artificial flavors, dried albumin, yellow mustard, palm oil, vitamin E, salt, egg white, water","egg,mustard"
"INGREDIENTS: riboflavin, niacin, vegetable oil, sardine, shellfish, baking powder, (may contain traces of sesame), lupin, fish oil, krill, lupin protein, yeast, glucose (for color), fish protein. CONTAINS lupin. MAY CONTAIN tree_nuts, lupin, peanut DUE TO SHARED EQUIPMENT","fish,lupin,peanut,sesame,shellfish,tree_nuts"
"sweet lupin, calamari, natural colors, shrimp, oyster sauce, lupin protein, lupin, mollusc extract, textured vegetable protein, hydrolyzed soy protein, citric acid (as stabilizer), vitamin D, soya","lupin,molluscs,shellfish,soy"
"vitamin E, arachis oil, rice flour, beta carotene, peanut butter, dextrose, potassium chloride, annatto, citric acid",peanut
"annatto, seafood, crawfish, langoustine, sodium bicarbonate, soya, sugar, mono and diglycerides","shellfish,soy"
"krill, glucose, rice flour, annatto, palm oil, lobster, beta carotene, sodium bicarbonate (for color), thiamine",shellfish
"glucose, (processed in a facility that also processes shellfish, dairy, tree_nuts), milk powder, salt, mussel, baking powder, sulfites, lupin protein, fructose, wheat gluten, dried fruits with sulfites, milk protein, milk solids, contains sulfites","dairy,dairy,lupin,molluscs,shellfish,sulphites,tree_nuts,wheat"
"guar gum, mustard, lecithin, celery leaves, canola oil, celery powder, corn starch, rice flour","celery,mustard"
"tapioca starch, calamari, whelk, turmeric, ground peanuts, preservatives, yeast, paprika extract, sulfur dioxide, water, snail","molluscs,peanut,sulphites"
"INGREDIENTS: folate, vitamin A, butter, salmon, vitamin D (for texture), (may contain traces of lupin, sulphites, egg), tapioca starch, lupini beans, carrageenan, cod, lactose, magnesium carbonate, yogurt","dairy,egg,fish,lupin,lupin,sulphites"
"peanut flour, sodium bicarbonate, water (as preservative), goober peas, natural colors, palm oil, hydrolyzed soy protein, fructose, corn starch, celery salt, sunflower oil, soya, peanut butter","celery,peanut,soy"
"tapioca starch, whey, xanthan gum, potassium chloride, carrageenan (for color), water, calcium carbonate, dextrose, corn starch, milk solids",dairy
"INGREDIENTS: salt (for color), baking powder, invert sugar, macadamia, lupini beans, almond, preservatives, lupin seeds, lecithin, guar gum, sweet lupin, sunflower oil, water, walnut. CONTAINS lupin","lupin,tree_nuts"
"modified starch, potato starch, preservatives (as stabilizer), folate, (may contain traces of dairy, wheat), salt (as stabilizer), glucose","dairy,wheat"
"walnut, baking powder (for color), vitamin A, guar gum, magnesium carbonate, peanut butter, mono and diglycerides, lecithin","peanut,tree_nuts"
"INGREDIENTS: paprika extract, maltodextrin, natural flavors (for color), celery spice, lecithin, palm oil, guar gum, magnesium carbonate, sodium bicarbonate. CONTAINS celery",celery
"carrageenan, peanut flour, peanut paste, vitamin E, water, canola oil, lactic acid, dextrose, natural flavors, treated with sulfites, contains sulfites, thiamine","peanut,sulphites"
"crayfish, bran, glucose, couscous, natural colors, crab, prawn, hydrolyzed wheat protein, preservatives, beta carotene","shellfish,wheat"
"natural colors, lactic acid, egg powder, canola oil, egg white, egg yolk",egg
"riboflavin, invert sugar, sunflower oil, magnesium carbonate, arachis oil, vitamin D, sodium bicarbonate, peanut butter",peanut
"INGREDIENTS: peanut flour, annatto, baking powder, celery salt, canola oil (as preservative), peanut butter, magnesium carbonate, lecithin, carrageenan, celery powder, maltodextrin, turmeric","celery,peanut"
"mayonnaise, shellfish extract, potassium chloride, calcium carbonate, sugar","egg,shellfish"
"preservatives, water, durum wheat, vitamin A, artificial flavors, dextrin, vitamin D, sunflower oil",wheat
"calcium carbonate, sunflower oil, celery juice, celery extract, sugar, potassium chloride, celery salt, egg powder, lecithin","celery,egg"
"INGREDIENTS: annatto, buttermilk, riboflavin, corn syrup, lactic acid, carrageenan, beta carotene. CONTAINS dairy. MAY CONTAIN lupin, shellfish, mustard DUE TO SHARED EQUIPMENT","dairy,lupin,mustard,shellfish"
"INGREDIENTS: palm oil, vitamin D, salt, baking powder, potassium bisulfite, magnesium carbonate, canola oil, carrageenan, mono and diglycerides. CONTAINS sulphites",sulphites
"INGREDIENTS: canola oil, lupin protein, whelk, lupin seeds, niacin, oyster sauce, lupini beans, water. CONTAINS lupin","lupin,molluscs"
"shellfish, paneer, shellfish extract, macadamia, xanthan gum, seafood, lecithin, folate","dairy,shellfish,tree_nuts"
"sugar, dextrose, natural flavors, wheat, lupin protein, canola oil, lupin concentrate, citric acid, seitan, lupin seeds, yeast, textured vegetable protein, tamari, wheat gluten, sunflower oil, modified starch","lupin,soy,wheat"
"INGREDIENTS: canola oil, wheat bran, folate, vitamin A, lecithin, natural colors. MAY CONTAIN lupin, soy, peanut DUE TO SHARED EQUIPMENT","lupin,peanut,soy,wheat"
"modified starch, water, riboflavin, glucose, potato starch, dried fruits with sulfites, citric acid, black sesame, pistachio, mono and diglycerides, fructose, preserved with sulfites, sodium bisulfite","sesame,sulphites,tree_nuts"
"mustard extract, xanthan gum, peanut oil, skimmed milk powder, artificial flavors, butter, vitamin A, monkey nuts, mustard paste, ground peanuts","dairy,mustard,peanut"
"egg white, guar gum, lactose, beta carotene, sodium bicarbonate, sweet lupin, water, lupin bean powder, vitamin A (as preservative), sunflower oil (as stabilizer), dried egg, egg yolk","dairy,egg,lupin"
"yeast, canola oil, rice flour, maltodextrin (as preservative), potassium metabisulfite, corn syrup, fructose, potato starch (as stabilizer), citric acid, sodium sulfite",sulphites
"artificial flavors, xanthan gum, fish extract, mustard paste, dextrose, fish paste, thiamine, glucose, mustard, fish, vitamin A, vitamin E","fish,mustard"
"INGREDIENTS: dextrose, soy sauce, lecithin, baking powder, krill, fructose, natural colors, natto, canola oil. CONTAINS soy, shellfish. MAY CONTAIN fish, molluscs DUE TO SHARED EQUIPMENT","fish,molluscs,shellfish,soy"
"INGREDIENTS: water (as preservative), niacin, sodium bicarbonate, calcium carbonate (for texture), carrageenan",none
"sugar, (may contain traces of dairy, molluscs), vitamin D, natural flavors","dairy,molluscs"
"natural colors, baking powder, beta carotene, lactic acid, mustard oil, egg powder, scallop, vitamin E, yeast, glucose, vegetable oil","egg,molluscs,mustard"
"potato starch, lupin concentrate, preservatives, natural colors, modified starch, niacin, magnesium carbonate, sugar",lupin
"INGREDIENTS: maltodextrin, fructose (for texture), corn starch, sodium bicarbonate",none
"INGREDIENTS: pine nut, crawfish, almond milk, fish paste, seafood, soy lecithin, sugar, citric acid, soy, niacin (for texture), langoustine, fish protein, hydrolyzed soy protein, tuna. CONTAINS fish, shellfish. MAY CONTAIN tree_nuts, lupin, fish DUE TO SHARED EQUIPMENT","fish,lupin,shellfish,soy,tree_nuts"
"sunflower oil, tempeh, yeast, vitamin A, modified starch, magnesium carbonate, annatto, dried fruits with sulfites, xanthan gum, potassium metabisulfite, preserved with sulfites","soy,sulphites"
"potassium metabisulfite, lactic acid, lysozyme, egg yolk, tapioca starch, folate, sodium metabisulfite, sugar, yeast, palm oil","egg,sulphites"
"(may contain traces of lupin, sesame), guar gum, cod, invert sugar, fish sauce, water, modified starch, citric acid","fish,lupin,sesame"
"INGREDIENTS: potassium chloride (as preservative), vitamin A, water, sugar, baking powder, mono and diglycerides (as stabilizer), lupin, lupini, (may be present: fish, egg, shellfish), lupine, invert sugar. CONTAINS lupin, shellfish, fish, egg. MAY CONTAIN mustard, molluscs, dairy DUE TO SHARED EQUIPMENT","dairy,egg,fish,lupin,molluscs,mustard,shellfish"
"xanthan gum, vitamin D, modified starch, annatto, rice flour, calcium carbonate",none
"INGREDIENTS: canola oil, ghee, sunflower oil, artificial flavors, glucose, fructose",dairy
"egg, folate, guar gum, celery seasoning, celery spice, albumin, dried egg, turmeric (for color), celery powder","celery,egg"
"potassium metabisulfite, pasta, wheat bran, wheat, maltodextrin, soy sauce, lactic acid, sodium metabisulfite, fructose, corn starch, glucose, carrageenan, sodium sulfite, soy lecithin","soy,sulphites,wheat"
"guar gum, palm oil, folate, maltodextrin, magnesium carbonate, carrageenan, rice flour, thiamine",none
"beta carotene, mayonnaise, potato starch, pasteurized egg, clam juice, albumin, fructose, sunflower oil","egg,molluscs"
"INGREDIENTS: vitamin D, beta carotene, baking powder (as preservative), potassium chloride, potato starch, lactic acid (as preservative), corn starch, yeast (as preservative)",none
"palm oil, crab, glucose, krill, seafood, rice flour, dextrose",shellfish
"INGREDIENTS: corn starch, artificial flavors, carrageenan, sugar, glucose (for color), water. MAY CONTAIN shellfish, peanut DUE TO SHARED EQUIPMENT",",peanut,shellfish"
"INGREDIENTS: salt, egg white, mustard extract, canola oil, yellow mustard, corn syrup, squid, surimi, tuna, egg protein, sugar (as preservative), snail, egg lecithin. CONTAINS egg, fish, molluscs, mustard","egg,fish,molluscs,mustard"
"corn starch, paprika extract, natural flavors, tapioca starch, sunflower oil, beer nuts, guar gum, corn syrup",peanut
"peanut oil, vitamin A, fructose, crawfish, beer nuts, macadamia, whelk, squid, beta carotene, almond flour, peanut sauce","molluscs,peanut,shellfish,tree_nuts"
"INGREDIENTS: shellfish, krill, almond milk, annatto (as preservative), vegetable oil, modified wheat starch, ground peanuts, artificial flavors, maltodextrin, baking powder, peanut oil, yeast, sweet lupin, lupini beans, vitamin D, shellfish extract. CONTAINS lupin. MAY CONTAIN peanut DUE TO SHARED EQUIPMENT","lupin,peanut,shellfish,tree_nuts,wheat"
"sulphites, sunflower oil, palm oil, (processed in a facility that also processes celery, wheat), corn starch, sulfur dioxide","celery,sulphites,wheat"
"water, paprika extract, corn syrup, tempeh, tamari, riboflavin, rice flour",soy
"ground nut oil, preservatives, rice flour, potato starch, corn starch, mustard oil, turmeric, beta carotene, mayonnaise, mustard extract","egg,mustard,peanut"
"sodium metabisulfite, sugar, egg yolk, preservatives, tofu, lupin concentrate, potassium bisulfite, sodium sulfite, magnesium carbonate (as stabilizer), lupin flour, (may be present: sesame, fish), riboflavin, carrageenan","egg,fish,lupin,sesame,soy,sulphites"
"sesame seed, citric acid, magnesium carbonate, arachis oil, soybean, peanut flour, oyster, soy flour, black sesame, maltodextrin, sesame paste, beer nuts, tamari","molluscs,peanut,sesame,soy"
"(may contain traces of dairy), thiamine, corn syrup, shellfish, langoustine, paprika extract, corn starch, shrimp paste","dairy,shellfish"
"celery leaves, corn starch, sodium bicarbonate, celery salt, citric acid, dextrose",celery
"cashew, riboflavin, dried albumin, black sesame, pecan, potassium chloride, meringue, albumin, cashew butter, vegetable oil, salt","egg,sesame,tree_nuts"
"INGREDIENTS: palm oil, lupini, modified food starch, sugar, mollusc powder, wheat gluten, lupin seeds, fish stock, krill, crab, (manufactured on equipment that also processes peanut, dairy), magnesium carbonate, shellfish, lupin concentrate. CONTAINS dairy, lupin, peanut, wheat, molluscs, shellfish. MAY CONTAIN tree_nuts DUE TO SHARED EQUIPMENT","dairy,fish,lupin,molluscs,peanut,shellfish,tree_nuts,wheat"
"INGREDIENTS: vitamin E, soy, lactic acid (as preservative), canola oil, dried albumin, egg powder, egg lecithin, natural flavoring. CONTAINS egg, soy, wheat","egg,soy,wheat"
"annatto (as stabilizer), riboflavin, ground peanuts, sugar, canola oil, lactic acid, natural flavors (for texture), citric acid, peanut sauce, invert sugar",peanut
"potato starch, dextrose, invert sugar, palm oil, celery leaves, artificial flavors, celery spice",celery
"INGREDIENTS: paprika extract, corn syrup, bread crumbs, sugar, rice flour, white sesame, flour, arachis oil, riboflavin, canola oil, palm oil, sesame paste. CONTAINS wheat, sesame, peanut","peanut,sesame,wheat"
"lecithin, palm oil (for texture), seafood, thiamine, sesame seed, tahini, rice flour, black sesame, sodium bicarbonate, folate, shrimp, salt (as stabilizer), vitamin A, crab","sesame,shellfish"
"beta carotene (for texture), shellfish extract, shellfish, crab, mono and diglycerides, invert sugar, vitamin A, palm oil",shellfish
"INGREDIENTS: milk solids, potassium chloride, tamari, dextrose, modified starch, xanthan gum. CONTAINS dairy, soy. MAY CONTAIN molluscs, wheat, mustard DUE TO SHARED EQUIPMENT","dairy,molluscs,mustard,soy,wheat"
"natural colors, salt, vitamin D, dextrose",none
"abalone, natural flavors, mollusc extract, celery leaves, celery juice, calcium carbonate, vegetable oil, tempeh, scallop","celery,molluscs,soy"
"yeast, fructose, celery seeds, niacin, annatto, baking powder",celery
"citric acid, thiamine, riboflavin, water",none
"palm oil, yeast, beta carotene, lupin concentrate, goober peas, magnesium carbonate, peanut butter","lupin,peanut"
"beta carotene, corn syrup, niacin, maltodextrin, guar gum, vitamin A, modified starch, folate",none
"INGREDIENTS: carrageenan, potato starch, natural colors, tapioca starch, guar gum (for color), artificial flavors, magnesium carbonate",none
"sunflower oil, soy flour, potassium chloride, maltodextrin",soy
"guar gum, paprika extract, periwinkle, carrageenan, palm oil, mollusc extract, glucose, natural flavors, sunflower oil",molluscs
"modified starch, canola oil, sesame seed, yeast, sesame, lecithin",sesame
"vitamin D, mustard paste, palm oil, water (as stabilizer), salt",mustard
"INGREDIENTS: prawn, folate, potato starch, crab, shrimp, baking powder, carrageenan, modified starch, corn starch, riboflavin",shellfish
"potato starch, fructose, celery spice, sesame paste, celery juice, riboflavin, calcium carbonate, white sesame, celery stalk, sesame oil, maltodextrin","celery,sesame"
"potato starch, fructose, glucose (as preservative), yeast, wheat protein, mustard oil, citric acid, beta carotene, canola oil","mustard,wheat"
"corn syrup, celeriac, sugar, guar gum, celery spice",celery
"mustard, invert sugar (for texture), rice flour, durum wheat, dijon mustard, natural flavors, mustard powder, artificial flavoring","mustard,wheat"
"durum wheat, baking powder, glucose, invert sugar (for color), egg, tahini, anchovy, celery, celery seeds, fish oil, annatto, tapioca starch, sesame protein, mackerel, canola oil (as preservative), lysozyme, egg lecithin","celery,egg,fish,sesame,wheat"
"INGREDIENTS: corn starch, riboflavin, xanthan gum, glucose, durum wheat, egg, corn syrup, (produced in a facility that handles fish, tree_nuts), dextrin, carrageenan, seitan, sodium bicarbonate (as stabilizer). CONTAINS tree_nuts. MAY CONTAIN dairy, egg, molluscs DUE TO SHARED EQUIPMENT","dairy,egg,fish,molluscs,tree_nuts,wheat"
"riboflavin, fructose, sodium bicarbonate, gingelly oil, canola oil, salt, mustard paste, tahini, xanthan gum, potassium chloride, black sesame","mustard,sesame"
"xanthan gum, fructose, (may be present: celery), beta carotene (as stabilizer)",celery
"beta carotene, magnesium carbonate, peanut butter, peanut paste, niacin, glucose, guar gum, peanut flour, corn syrup",peanut
"INGREDIENTS: soy lecithin, folate, lactic acid, sesame paste, artificial flavors, tapioca starch, soy protein, sesame oil, water, edamame, baking powder, lecithin, yeast","sesame,soy"
"fish protein, maltodextrin, mackerel, carrageenan, riboflavin, niacin, citric acid, celery juice, glucose, natural colors","celery,fish"
"folate, palm oil, glucose (as preservative), sugar, vegetable oil (as stabilizer), celery seeds",celery
"INGREDIENTS: preservatives, mono and diglycerides (as stabilizer), artificial flavors, baking powder, natural colors, sodium bicarbonate, rice flour, modified starch",none
"INGREDIENTS: lecithin, glucose, modified starch, rice flour, egg powder. CONTAINS egg. MAY CONTAIN shellfish DUE TO SHARED EQUIPMENT","egg,shellfish"
"peanut protein, whelk, turmeric, peanut sauce, lactic acid, fructose, scallop, mollusc extract, lecithin","molluscs,peanut"
"INGREDIENTS: carrageenan, paprika extract, vitamin E (for color), vitamin D, lecithin, calcium carbonate, canola oil",none
"canola oil (for texture), thiamine, dried fruits with sulfites, yeast",sulphites
"corn syrup, rice flour, lactic acid, modified starch, potassium chloride (for color), paprika extract, vitamin A",none
"vegetable oil, mono and diglycerides, flour, beta carotene, preservatives (for color), natural flavors, seitan, annatto, soy, semolina, potato starch","soy,wheat"
"INGREDIENTS: curd, fish oil, guar gum, natural flavors, beta carotene, xanthan gum, sesame protein, buttermilk, almond milk, tuna, magnesium carbonate. MAY CONTAIN lupin, mustard DUE TO SHARED EQUIPMENT","dairy,fish,lupin,mustard,sesame,tree_nuts"
"artificial flavors, maltodextrin, corn starch (as preservative), arachis oil, mustard oil, guar gum, ground nut oil, peanut sauce, thiamine, yellow mustard, mustard flour","mustard,peanut"
"INGREDIENTS: citric acid, baking powder, peanut butter, folate, calcium carbonate, vitamin D, sodium bicarbonate, tapioca starch, maltodextrin, paneer. MAY CONTAIN molluscs, sesame, lupin DUE TO SHARED EQUIPMENT","dairy,lupin,molluscs,peanut,sesame"
"sugar, corn starch, vitamin E, egg lecithin, egg, celery extract, natural flavors, wine preservative (sulfites), dextrose, potassium chloride, sodium sulfite, ground nut oil, cashew, peanut paste, potassium bisulfite, thiamine","celery,egg,peanut,sulphites,tree_nuts"
"sodium bisulfite, magnesium carbonate, beta carotene (as preservative), artificial flavors, yeast, citric acid",sulphites
"potassium chloride, squid, artificial flavors, tapioca starch, egg lecithin, corn syrup, mono and diglycerides, mustard powder, folate, mollusc powder, mustard seed, clam, riboflavin, maltodextrin, mustard extract","egg,molluscs,mustard"
"annatto, edamame, vitamin D, celery stalk, tamari, modified starch (as preservative), potassium chloride, sesame, (may contain traces of lupin, soy), natural flavors, gingelly oil, calcium carbonate, vitamin E (for texture), soy flour, sesame oil, glucose","celery,lupin,sesame,soy,soy"
"vegetable oil, celery leaves, modified food starch, natural colors, beta carotene, annatto (for texture), vitamin A, wheat gluten, magnesium carbonate, semolina","celery,wheat"
"citric acid, thiamine, potassium chloride, potato starch, crayfish, sugar, xanthan gum, shrimp, folate, artificial flavors, scallop","molluscs,shellfish"
"natural flavors, mustard powder, magnesium carbonate, malt extract, lecithin, semolina, mustard extract, artificial flavoring","mustard,wheat"
"artificial flavors, potassium chloride (as preservative), canola oil, marzipan, pistachio, salt (as stabilizer), vegetable oil",tree_nuts
"folate, citric acid, tamari, celery, sugar, squid, potato starch, rice flour, vitamin E, niacin, egg wash, fish stock, albumin, hydrolyzed soy protein","celery,egg,fish,molluscs,soy"
"potassium metabisulfite, lupin bean powder, niacin, mono and diglycerides, lupini beans, paprika extract, contains sulfites, cheese, calcium carbonate, milk protein isolate, sweet lupin","dairy,lupin,sulphites"
"krill, glucose, shellfish extract, preservatives, dextrose, citric acid",shellfish
"lupin, preservatives, milk protein isolate, lupin flour, fish extract, modified starch (for color), annatto, mustard flour, sweet lupin, salt, anchovy, potato starch","dairy,fish,lupin,mustard"
"marzipan, glucose, pine nut, palm oil, artificial flavors, lecithin, niacin, invert sugar (for color)",tree_nuts
"INGREDIENTS: buttermilk, tapioca starch (as preservative), fish extract, vegetable oil, calcium carbonate, whey. CONTAINS dairy, fish. MAY CONTAIN tree_nuts DUE TO SHARED EQUIPMENT","dairy,fish,tree_nuts"
"lupine, sulfites, soy sauce, corn starch, lupin flour, yeast (for color), water, potassium metabisulfite, soya, sodium bisulfite, lupin protein","lupin,soy,sulphites"
"INGREDIENTS: carrageenan (as preservative), mussel, invert sugar, fructose, natural flavors, lupin concentrate, xanthan gum, periwinkle, folate, dextrose, lupini beans, lupine, magnesium carbonate","lupin,molluscs"
"lupini beans, fructose (as preservative), paprika extract, niacin, lupine, guar gum, artificial flavors (as stabilizer), water, lactic acid (for color)",lupin
"INGREDIENTS: sunflower oil, corn starch (as stabilizer), guar gum, wheat bran, paprika extract, flour, invert sugar (for color), calcium carbonate (as stabilizer)",wheat
"rice flour, niacin, lysozyme, fructose, preservatives, mayonnaise, maltodextrin, egg wash",egg
"turmeric (as preservative), citric acid, carrageenan, surimi, natural colors, egg white, rice flour, fish powder, salmon, paprika extract, glucose, egg protein, dried albumin","egg,fish"
"INGREDIENTS: rice flour, wheat germ, peanut, bread crumbs, artificial flavoring, salt (for texture), goober peas, glucose. CONTAINS wheat. MAY CONTAIN fish DUE TO SHARED EQUIPMENT","fish,peanut,wheat"
"mono and diglycerides, glucose, pasteurized egg, sugar, vitamin D, sesame protein, guar gum","egg,sesame"
"artificial flavors, abalone, whelk, tuna, palm oil, shrimp paste, lobster, fish oil, maltodextrin, natural flavors, crawfish","fish,molluscs,shellfish"
"INGREDIENTS: dextrose (for color), tapioca starch, thiamine, yeast, carrageenan, turmeric, annatto, baking powder",none
"magnesium carbonate, water, potato starch, citric acid, glucose, mono and diglycerides",none
