ingredient_text,allergens
"INGREDIENTS: lupin seeds, folate, egg wash, soy flour, modified starch, salt, sweet lupin, vegetable oil, lysozyme, celery salt, wheat gluten, sugar, (produced in a facility that handles tree_nuts, peanut), natural colors, vitamin A, lecithin, celery seasoning. CONTAINS wheat. MAY CONTAIN shellfish, dairy, egg DUE TO SHARED EQUIPMENT","celery,dairy,egg,lupin,peanut,shellfish,soy,tree_nuts,wheat"
"preservatives, fish extract, vitamin A, citric acid, niacin, vegetable oil, pecan, chestnut, corn syrup, folate, corn starch (as stabilizer)","fish,tree_nuts"
"curd, lupin, potato starch, preservatives, guar gum, xanthan gum, vitamin E, corn syrup, magnesium carbonate","dairy,lupin"
"oyster, palm oil, (processed in a facility that also processes shellfish), squid, vitamin A (as preservative), whelk, riboflavin, niacin, rice flour","molluscs,shellfish"
"INGREDIENTS: paprika extract, hazelnut, marzipan, potassium chloride, beta carotene, natural colors. CONTAINS tree_nuts. MAY CONTAIN celery, egg, wheat DUE TO SHARED EQUIPMENT","celery,egg,tree_nuts,wheat"
"INGREDIENTS: carrageenan, langoustine, peanut oil, invert sugar, niacin (as stabilizer), shellfish extract, corn starch (for color), ground nut oil, magnesium carbonate. CONTAINS peanut, shellfish","peanut,shellfish"
"palm oil (as preservative), sugar, rice flour, calcium carbonate, mustard extract, xanthan gum, folate, potassium chloride, citric acid",mustard
"INGREDIENTS: thiamine, glucose, magnesium carbonate, yeast, vitamin D, mollusc extract, sesame seed, mustard paste","molluscs,mustard,sesame"
"INGREDIENTS: riboflavin, potato starch, tapioca starch (for color), vitamin E, calcium carbonate",none
"INGREDIENTS: mustard oil, lecithin, mustard powder, carrageenan, natural flavors, (produced in a facility that handles egg, peanut), fructose, niacin, globulin. MAY CONTAIN egg, sesame DUE TO SHARED EQUIPMENT","egg,mustard,peanut,sesame"
"baking powder, lactic acid, paprika extract, sugar, magnesium carbonate, paneer, milk solids, salt, milk protein, fish oil","dairy,fish"
"magnesium carbonate, shellfish extract, thiamine, canola oil, sugar, yeast, rice flour, potassium chloride",shellfish
"preservatives, thiamine, baking powder, artificial flavors, soybean, lactic acid, maltodextrin, wheat, caramel color, tamari","soy,wheat"
"vitamin E, lecithin, cod, corn syrup",fish
"INGREDIENTS: mustard seed, lecithin, sodium bicarbonate, mustard paste, dijon mustard, modified starch (for texture), artificial flavors, (produced in a facility that handles sesame), citric acid (as preservative), preservatives, corn starch. CONTAINS sesame. MAY CONTAIN celery, dairy DUE TO SHARED EQUIPMENT","celery,dairy,mustard,sesame"
"INGREDIENTS: yogurt, riboflavin, butter, glucose, yeast, beta carotene, ghee, tapioca starch. CONTAINS dairy",dairy
"INGREDIENTS: hazelnut, vitamin E, walnut oil, yeast, abalone, artificial flavors, natural colors, cashew butter, lupin bean powder, lupin, peanut oil, octopus, peanut protein, vitamin A (as preservative), niacin, paprika extract (as preservative), sunflower oil","lupin,molluscs,peanut,tree_nuts"
"INGREDIENTS: fructose, modified starch, celeriac, celery seeds, potassium chloride, riboflavin, celery extract, sesame protein, natural colors, dextrose, thiamine, tahini","celery,sesame"
"mustard oil, modified starch, beta carotene, preservatives",mustard
"potato starch, tapioca starch, invert sugar, sodium bicarbonate, thiamine, (processed in a facility that also processes shellfish, molluscs, celery)","celery,molluscs,shellfish"
"yeast, lactic acid, maltodextrin, sodium bicarbonate, vitamin E, corn syrup, beta carotene",none
"celery, egg protein, celery stalk, globulin, milk, palm oil, celery salt, annatto, calamari, vitamin D, rice flour, water, magnesium carbonate, corn syrup, octopus","celery,dairy,egg,molluscs"
"INGREDIENTS: lecithin (as stabilizer), baking powder (for color), preservatives, corn syrup, salt, vitamin E, vegetable oil",none
"INGREDIENTS: sodium bicarbonate, natural colors, soya, lupin concentrate, glucose, fructose, hydrolyzed soy protein, mono and diglycerides (for color), soy, maltodextrin, corn syrup","lupin,soy"
"riboflavin, meringue, xanthan gum (for texture), vitamin A, fructose, dried fruits with sulfites, vegetable oil, natural colors, preservatives, egg yolk, lysozyme","egg,sulphites"
"guar gum, lactic acid, tuna, rice flour, paprika extract, mustard powder, sunflower oil, mackerel, sugar, mustard, mustard flour","fish,mustard"
"tahini, mono and diglycerides, lupin flour, yeast, sodium bicarbonate, lupin concentrate, black sesame, artificial flavors, vegetable oil, sweet lupin, potato starch","lupin,sesame"
"(processed in a facility that also processes egg), vitamin A, sugar, mono and diglycerides, natural flavors, milk powder, sodium caseinate","dairy,egg"
"natural colors, cod, fish stock, dextrose, paprika extract, ground nut oil, surimi, lysozyme, peanut oil, peanut sauce, turmeric","egg,fish,peanut"
"almond milk, mustard powder, cashew, magnesium carbonate, walnut oil, mustard paste, potato starch, sunflower oil, vitamin A, corn starch, vitamin E (as preservative)","mustard,tree_nuts"
"palm oil, sugar, natural flavors, riboflavin, vitamin D, rice flour, preservatives, yeast",none
"potato starch, dextrose, carrageenan, sunflower oil, soy lecithin, tamari, natural colors, niacin, vitamin E (for texture), citric acid",soy
"lactic acid, baking powder, sodium bicarbonate, potato starch",none
"dairy cream, natural colors, natural flavors (as preservative), treated with sulfites, ghee, dextrose (for texture), glucose","dairy,sulphites"
"potassium chloride, tapioca starch (as stabilizer), paprika extract",none
"INGREDIENTS: tofu, tapioca starch, lupin flour, lupin seeds, soya, maltodextrin, paprika extract, sweet lupin, mustard extract, artificial flavors, thiamine. CONTAINS mustard, lupin","lupin,mustard,soy"
"egg powder, meringue, preserved with sulfites, pecan, pistachio, magnesium carbonate, egg wash, potato starch, citric acid, vegetable oil","egg,sulphites,tree_nuts"
"lactic acid (as preservative), sesame, sulfites, sesame flour, magnesium carbonate, sodium bisulfite, fructose, paprika extract","sesame,sulphites"
"INGREDIENTS: sodium bicarbonate, riboflavin, niacin (for texture), shellfish, xanthan gum. CONTAINS shellfish",shellfish
"shellfish extract, corn syrup, tofu, annatto, hydrolyzed wheat protein, couscous, folate, shellfish, modified starch, potassium chloride, tamari, baking powder","shellfish,soy,wheat"
"mustard paste, canola oil, potato starch, mustard seed, annatto, invert sugar, lupin bean powder, marzipan, modified starch, yellow mustard, almond milk, lupin concentrate, vegetable oil, magnesium carbonate","lupin,mustard,tree_nuts"
"hazelnut, fructose, sugar (as preservative), beta carotene (for texture), surimi","fish,tree_nuts"
"INGREDIENTS: maltodextrin, corn starch, sodium bicarbonate, citric acid, magnesium carbonate, oyster, xanthan gum. CONTAINS molluscs",molluscs
"INGREDIENTS: paprika extract, celery seasoning, dextrose, artificial flavors, celery root, celery powder, tapioca starch, salt, natural flavors. CONTAINS celery. MAY CONTAIN shellfish, celery, sulphites DUE TO SHARED EQUIPMENT","celery,shellfish,sulphites"
"natural colors, dextrose, folate, magnesium carbonate, fructose (for color), artificial flavors, water, annatto",none
"krill, crab, niacin, riboflavin, carrageenan (as stabilizer), maltodextrin, artificial flavors, citric acid, natural colors (as stabilizer)",shellfish
"invert sugar, guar gum, lactic acid, carrageenan, annatto, egg white, vitamin D (as preservative), contains sulfites, egg lecithin, (may contain traces of molluscs, sesame, sulphites)","egg,molluscs,sesame,sulphites,sulphites"
"sodium bicarbonate (as stabilizer), mustard powder, fish oil, modified starch, mustard paste, carrageenan (as stabilizer), xanthan gum, magnesium carbonate, guar gum, niacin, lactic acid","fish,mustard"
"lecithin (as stabilizer), soybean, salmon, soy flour, glucose, mustard oil, artificial flavors, palm oil (as stabilizer), anchovy, fish powder, vegetable oil, dijon mustard, soy, yellow mustard, vitamin A (as stabilizer), sodium bicarbonate","fish,mustard,soy"
"modified starch, surimi, sugar, folate, cod, yeast, fish paste, sunflower oil (for texture), cream, paprika extract, lactic acid (as preservative)","dairy,fish"
"tapioca starch, modified starch, turmeric, anchovy, fish oil, potassium chloride (for color)",fish
"INGREDIENTS: sulfur dioxide, milk protein, mustard oil, canola oil, treated with sulfites, miso, corn syrup, hydrolyzed soy protein, dijon mustard, palm oil, natural flavors, dextrose (as preservative), milk powder, glucose, celery spice, celery seasoning, vitamin A, citric acid","celery,dairy,mustard,soy,sulphites"
"yogurt, yeast, niacin (as preservative), milk solids, vitamin D, preservatives, vegetable oil, milk fat, lecithin, canola oil, tempeh","dairy,soy"
"almond paste, turmeric, pistachio, walnut, niacin, goober peas, salt, peanut paste, potassium bisulfite, artificial flavors, ground peanuts","peanut,sulphites,tree_nuts"
"INGREDIENTS: tapioca starch, invert sugar, corn syrup (as preservative), vitamin A, turmeric, sunflower oil. MAY CONTAIN egg DUE TO SHARED EQUIPMENT",",egg"
"peanut sauce, baking powder, lactic acid, rice flour, sesame flour, fructose, goober peas, ground nut oil, vitamin A, whole wheat flour","peanut,sesame,wheat"
"yeast, tahini, cheese, milk protein, sesame flour, pecan, tapioca starch, paneer, annatto, natural flavors, turmeric","dairy,sesame,tree_nuts"
"INGREDIENTS: celery powder, invert sugar, paprika extract, corn starch, citric acid, rice flour, tapioca starch, vitamin A, celery root, vitamin E. CONTAINS celery",celery
"mono and diglycerides, tuna, soybean, lecithin (as preservative), natural flavors, (manufactured on equipment that also processes peanut, molluscs), sardine, sunflower oil, canola oil, vegetable oil","fish,molluscs,peanut,soy"
"mono and diglycerides, oyster sauce, corn syrup, dextrose, walnut oil, vitamin D, lactic acid, peanut sauce, peanut oil, turmeric, sunflower oil","molluscs,peanut,tree_nuts"
"fructose, (may contain traces of shellfish, sesame), seafood, vitamin A, textured vegetable protein, soy flour, prawn, magnesium carbonate, soy lecithin","sesame,shellfish,shellfish,soy"
"INGREDIENTS: corn syrup, dextrose, annatto, fructose, yeast, citric acid, niacin, rice flour",none
"glucose (for color), calcium carbonate, niacin, snail, dextrose, dijon mustard, sardine, mustard powder, (produced in a facility that handles egg), anchovy, periwinkle, mustard oil, celery seasoning, natural colors, mollusc powder","celery,egg,fish,molluscs,mustard"
"folate, vitamin A, sugar, vitamin E, celery powder, celery, semolina, guar gum, celery leaves, egg wash, turmeric, tapioca starch (for color), thiamine","celery,egg,wheat"
"almond paste, potassium chloride, mono and diglycerides, chestnut, vitamin D, folate, salmon, fish protein","fish,tree_nuts"
"canola oil, magnesium carbonate, (may be present: soy, wheat), folate, sesame flour, baking powder, sesame, sesame protein","sesame,soy,wheat"
"INGREDIENTS: riboflavin, lactic acid, casein, mono and diglycerides (as stabilizer), guar gum, glucose (for texture), lecithin, paneer, yeast (for color), skimmed milk powder, invert sugar. MAY CONTAIN shellfish, dairy DUE TO SHARED EQUIPMENT","dairy,shellfish"
"INGREDIENTS: oyster sauce, xanthan gum, clam juice, palm oil, potato starch, maltodextrin. CONTAINS molluscs. MAY CONTAIN celery, tree_nuts, wheat DUE TO SHARED EQUIPMENT","celery,molluscs,tree_nuts,wheat"
"dextrose (as preservative), tapioca starch, modified starch, natural colors, almond flour, palm oil, potassium chloride, beta carotene, sugar, (manufactured on equipment that also processes lupin, fish)","fish,lupin,tree_nuts"
"palm oil, riboflavin, vitamin A, maltodextrin, sodium bicarbonate (for color), carrageenan, glucose",none
"sugar, glucose, beta carotene (for texture)",none
"INGREDIENTS: preserved with sulfites, sunflower oil, preservatives, potassium bisulfite, palm oil, vegetable oil, turmeric (for texture). CONTAINS sulphites. MAY CONTAIN lupin, mustard, soy DUE TO SHARED EQUIPMENT","lupin,mustard,soy,sulphites"
"fish, vitamin E, celery powder, palm oil, surimi, vegetable oil, whole wheat flour, maltodextrin, anchovy, celery salt, mono and diglycerides, corn syrup","celery,fish,wheat"
"vitamin D (as stabilizer), clam, baking powder, lupin seeds, (may be present: dairy, sulphites, tree_nuts), sweet lupin, potato starch, celery extract, natural colors, lupine, celery powder","celery,dairy,lupin,molluscs,sulphites,tree_nuts"
"INGREDIENTS: mackerel, yeast, vegetable oil, annatto (as stabilizer)",fish
"mustard oil, mustard paste, xanthan gum, dijon mustard, salt, mono and diglycerides, canola oil, (produced in a facility that handles dairy), turmeric, maltodextrin, citric acid (as stabilizer)","dairy,mustard"
"peanut protein, citric acid, soy flour, peanut, carrageenan, artificial flavors, folate (as stabilizer), peanut paste, beta carotene, tempeh","peanut,soy"
"potassium chloride, shrimp paste, seafood, beta carotene, glucose, carrageenan",shellfish
"INGREDIENTS: sunflower oil (for texture), vitamin D, sodium bicarbonate (as preservative), vegetable oil, citric acid, mono and diglycerides, folate. MAY CONTAIN celery DUE TO SHARED EQUIPMENT",",celery"
"potassium chloride, vitamin A, dried egg, corn syrup, mono and diglycerides, soy protein, maltodextrin, sulfur dioxide, sunflower oil (for texture), egg protein, textured vegetable protein, vitamin D, sodium bisulfite, annatto, yogurt, egg yolk, chestnut","dairy,egg,soy,sulphites,tree_nuts"
"xanthan gum (for texture), almond paste, tapioca starch, carrageenan, glucose, calamari","molluscs,tree_nuts"
"pasta, sodium metabisulfite, glucose, celery extract, celery juice, potassium bisulfite, beta carotene, celery salt, preserved with sulfites, til, canola oil, invert sugar","celery,sesame,sulphites,wheat"
"celery juice, vitamin E, potassium chloride, celery root, celery extract, palm oil, sesame paste, white sesame, sesame protein","celery,sesame"
"modified starch, mono and diglycerides, sodium bicarbonate, lactic acid, glucose, soy, vitamin E",soy
"INGREDIENTS: mustard extract, fish stock, riboflavin, paprika extract, tuna, magnesium carbonate, anchovy, fructose. MAY CONTAIN shellfish, mustard, molluscs DUE TO SHARED EQUIPMENT","fish,molluscs,mustard,shellfish"
"INGREDIENTS: vitamin E (as preservative), fructose, invert sugar, lecithin, guar gum, mono and diglycerides, natural colors, glucose. MAY CONTAIN peanut, soy, dairy DUE TO SHARED EQUIPMENT",",dairy,peanut,soy"
"INGREDIENTS: maltodextrin, fish powder, mustard flour, lupin seeds, calcium carbonate, canola oil, palm oil, lupine, mussel, cod. CONTAINS fish, mustard, lupin, molluscs","fish,lupin,molluscs,mustard"
"yeast, mono and diglycerides (for color), folate (for color), lactic acid, paprika extract (for texture), beta carotene, potassium chloride, thiamine",none
"(may contain traces of peanut, lupin, molluscs), invert sugar, magnesium carbonate, lecithin (for color), milk protein isolate, vitamin D, turmeric, butter, paneer, corn syrup (for color), octopus","dairy,lupin,molluscs,molluscs,peanut"
"INGREDIENTS: vitamin A, globulin, egg white, pasteurized egg, caramel color, salt, scallop, canola oil, squid, celery leaves","celery,egg,molluscs,wheat"
"INGREDIENTS: niacin (as preservative), invert sugar, vegetable oil (as stabilizer), lecithin (as stabilizer), xanthan gum. MAY CONTAIN peanut, soy DUE TO SHARED EQUIPMENT",",peanut,soy"
"thiamine, paprika extract, vitamin D, potassium chloride, riboflavin, sugar, rice flour, annatto",none
"natural flavors, dijon mustard, milk powder, soy flour, vitamin A, sodium bicarbonate, sweet lupin, lupini, mustard, maltodextrin, water, mustard paste, lactose, artificial flavors, guar gum, fish paste, folate, salmon, textured vegetable protein, fish extract","dairy,fish,lupin,mustard,soy"
"wine preservative (sulfites), egg, potassium metabisulfite, almond, potassium chloride, egg lecithin, lecithin, sulphites, potato starch, lysozyme, salt","egg,sulphites,tree_nuts"
"INGREDIENTS: fish protein, artificial flavors, monkey nuts, vitamin A, sodium bicarbonate, potassium chloride, peanut. CONTAINS fish, peanut","fish,peanut"
"vegetable oil, yeast, peanut protein, almond, artificial flavors, corn starch, cashew, palm oil","peanut,tree_nuts"
"lactic acid, fructose, maltodextrin, calcium carbonate, invert sugar (as stabilizer)",none
"mustard seed, fructose, sesame paste, til, mustard extract, pasteurized egg, white sesame, lysozyme, modified starch, annatto, (manufactured on equipment that also processes sesame, mustard), fish protein, natural flavors, palm oil, mustard flour, cod, mono and diglycerides, mayonnaise","egg,fish,mustard,mustard,sesame,sesame"
"natural colors, rice flour, vegetable oil, sodium bicarbonate, pasteurized egg, vitamin A, potato starch, tapioca starch, dried albumin, niacin (for color)",egg
"INGREDIENTS: dried albumin, celery salt, tempeh, canola oil, lactic acid, whelk, egg wash, water (as preservative), mussel, sodium bicarbonate, potassium chloride, celery seeds, celery seasoning, artificial flavors, preservatives. CONTAINS molluscs, soy, celery, egg. MAY CONTAIN sesame, mustard, soy DUE TO SHARED EQUIPMENT","celery,egg,molluscs,mustard,sesame,soy"
"glucose, folate, mono and diglycerides (for texture), citric acid",none
"INGREDIENTS: sesame seed, mussel, almond, vitamin D (for color), octopus, gingelly oil, natural flavors, oyster sauce, maltodextrin, invert sugar (for texture), lecithin, hydrolyzed soy protein, soy, sesame protein, tamari. CONTAINS soy. MAY CONTAIN tree_nuts DUE TO SHARED EQUIPMENT","molluscs,sesame,soy,tree_nuts"
"INGREDIENTS: guar gum, vitamin A, xanthan gum. MAY CONTAIN wheat DUE TO SHARED EQUIPMENT",",wheat"
"maltodextrin, magnesium carbonate, riboflavin, vitamin D, corn starch, snail",molluscs
"INGREDIENTS: carrageenan, salt, natto, dextrose, shellfish, soy lecithin, crab, textured vegetable protein, lecithin, potassium chloride (as preservative), citric acid. CONTAINS shellfish. MAY CONTAIN peanut, celery DUE TO SHARED EQUIPMENT","celery,peanut,shellfish,soy"
"modified starch, corn syrup, xanthan gum, lactic acid",none
"INGREDIENTS: tapioca starch (as stabilizer), baking powder, sunflower oil, celery stalk, celery juice, sodium caseinate. CONTAINS celery, dairy","celery,dairy"
"squid, celery leaves, meringue, sodium bicarbonate, clam, abalone, mayonnaise, corn starch, magnesium carbonate, vitamin D, vegetable oil, egg lecithin, tapioca starch, water","celery,egg,molluscs"
"curd, natural colors, mono and diglycerides, potato starch, baking powder, palm oil, modified starch, sesame, citric acid, mustard, tapioca starch, sesame protein","dairy,mustard,sesame"
"lactose, tapioca starch, annatto (for texture), dextrose",dairy
"dextrose, glucose, xanthan gum, potassium chloride, vitamin E, carrageenan, palm oil, folate",none
"peanut flour, invert sugar, artificial flavors, baking powder, lupin, mono and diglycerides, ground peanuts, sodium metabisulfite, arachis oil, salt, thiamine, vegetable oil, preservatives, potassium bisulfite, lupin concentrate","lupin,peanut,sulphites"
"lupini beans, sweet lupin, invert sugar, beta carotene, lecithin, calcium carbonate, lupini, vegetable oil, dextrose, fructose",lupin
"potassium chloride, ghee, tahini, carrageenan, natural flavors, baking powder, cashew, sugar, black sesame, almond, annatto, cheese, milk, marzipan, citric acid","dairy,sesame,tree_nuts"
"INGREDIENTS: natural flavors, calcium carbonate, salt, lactic acid, yeast, snail, sodium bicarbonate (as preservative), magnesium carbonate, potato starch, mustard oil, scallop. CONTAINS molluscs","molluscs,mustard"
"natto, whey, glucose, vitamin A, calcium carbonate, yeast, magnesium carbonate, soy lecithin, folate, natural flavors, milk","dairy,soy"
"clam juice, vitamin E, skimmed milk powder, guar gum, milk protein, salt, mussel, sunflower oil, annatto","dairy,molluscs"
"INGREDIENTS: sesame flour, bread crumbs, vitamin A, turmeric, lupin seeds, annatto, modified starch (for texture), sodium sulfite, guar gum, wheat. MAY CONTAIN soy, sesame DUE TO SHARED EQUIPMENT","lupin,sesame,soy,sulphites,wheat"
"annatto, celery salt, lactic acid, celery, carrageenan, calcium carbonate, vitamin E, vitamin D",celery
"potassium chloride, (produced in a facility that handles egg, lupin), ghee, maltodextrin, vitamin A, mono and diglycerides, milk fat, artificial flavors, lactose, potato starch, lupini, preservatives","dairy,egg,lupin,lupin"
"water (as preservative), riboflavin, tapioca starch, lecithin, shrimp paste, vitamin D, turmeric, sugar, corn syrup, oyster","molluscs,shellfish"
"tapioca starch, natural colors, invert sugar, riboflavin, mono and diglycerides (for color)",none
"xanthan gum (for texture), paprika extract, guar gum, invert sugar, fructose, canola oil, vitamin A, rice flour",none
"tapioca starch, canola oil, carrageenan, potassium chloride, til",sesame
"INGREDIENTS: periwinkle, celery seeds, almond paste, lactose, salt, celery extract, mustard extract, celery leaves, beta carotene, rice flour, potato starch, yellow mustard","celery,dairy,molluscs,mustard,tree_nuts"
"INGREDIENTS: vitamin E, calamari, magnesium carbonate (as preservative), mustard flour, dijon mustard, potassium chloride, glucose, mussel, yellow mustard, niacin. CONTAINS mustard, molluscs. MAY CONTAIN lupin, soy DUE TO SHARED EQUIPMENT","lupin,molluscs,mustard,soy"
"INGREDIENTS: celery extract, yeast, water, celery seasoning, palm oil, calcium carbonate, marzipan, celery leaves, natural flavors, folate (for color), carrageenan. CONTAINS celery, tree_nuts","celery,tree_nuts"
"INGREDIENTS: potassium chloride (as stabilizer), tapioca starch (as stabilizer), water",none
"xanthan gum, vitamin A, peanut flour, lupin seeds, fructose, sesame, lupin bean powder, lupin flour, peanut, tahini","lupin,peanut,sesame"
"INGREDIENTS: baking powder, modified starch, natural colors, fructose, rice flour",none
"vitamin E (for color), cashew, vitamin D, soya, magnesium carbonate, almond paste, glucose, sugar, paprika extract, tapioca starch, sesame oil, vegetable oil","sesame,soy,tree_nuts"
"corn syrup, corn starch, rice flour, riboflavin, dextrose",none
"maltodextrin, preservatives, vitamin E, lactic acid (as preservative)",none
"INGREDIENTS: mono and diglycerides, lecithin (as stabilizer), (processed in a facility that also processes shellfish), rice flour, celery spice, maltodextrin, folate. CONTAINS shellfish, celery","celery,shellfish"
"INGREDIENTS: modified starch, peanut butter, niacin, xanthan gum, calcium carbonate, artificial flavors, peanut flour, lecithin, vitamin D (for texture), dextrose, arachis oil. CONTAINS peanut",peanut
"black sesame, potassium chloride, (may contain traces of wheat, sulphites, fish), lecithin, glucose, sugar, white sesame, potassium bisulfite, sodium metabisulfite, yeast","fish,sesame,sulphites,sulphites,wheat"
"INGREDIENTS: water, mono and diglycerides (for texture), paprika extract, natural flavors, turmeric, canola oil, magnesium carbonate. MAY CONTAIN mustard DUE TO SHARED EQUIPMENT",",mustard"
"dijon mustard, fish paste, palm oil (as preservative), tapioca starch, turmeric, water, vitamin E, rice flour, preservatives, fish stock, mustard extract, egg white, artificial flavors, mustard flour, peanut paste, egg protein","egg,fish,mustard,peanut"
"vegetable oil, beta carotene, celery seeds, vitamin D, water, preservatives, yeast, niacin (for color), paprika extract",celery
"xanthan gum, sodium bisulfite, sulphites, fish stock, fructose, natural colors, calcium carbonate, potassium metabisulfite, salmon","fish,sulphites"
"INGREDIENTS: vegetable oil, niacin (for texture), palm oil, vitamin D",none
"INGREDIENTS: xanthan gum (for texture), hydrolyzed wheat protein, mono and diglycerides, sodium bicarbonate, durum wheat, maltodextrin (for color), folate. CONTAINS wheat",wheat
"lupini, rice flour, annatto, water, salt, riboflavin",lupin
"corn syrup (as stabilizer), peanut oil, beta carotene, (produced in a facility that handles tree_nuts, molluscs, shellfish), peanut butter, natural colors, artificial flavors (as stabilizer), mustard extract, dextrose, paprika extract","molluscs,mustard,peanut,shellfish,tree_nuts"
"lupin flour, lupin, riboflavin, annatto (as stabilizer), thiamine, tempeh, folate, natural flavors","lupin,soy"
"INGREDIENTS: fructose, whole wheat flour, natural flavoring, periwinkle, lactic acid, maltodextrin, glucose, sodium bicarbonate. CONTAINS wheat, molluscs. MAY CONTAIN wheat DUE TO SHARED EQUIPMENT","molluscs,wheat"
"INGREDIENTS: dextrose, beer nuts, vitamin D, (produced in a facility that handles egg, fish), goober peas, lactic acid, peanut paste, canola oil, sugar, vitamin A. CONTAINS egg, peanut, fish. MAY CONTAIN peanut, dairy DUE TO SHARED EQUIPMENT","dairy,egg,fish,peanut"
"INGREDIENTS: baking powder, cod, anchovy, mustard extract, vitamin D, dairy cream, potassium chloride, sugar, natural flavors, sodium caseinate, salt, calcium carbonate, milk solids, celery root, celeriac, surimi. CONTAINS celery, mustard, dairy, fish. MAY CONTAIN egg, shellfish DUE TO SHARED EQUIPMENT","celery,dairy,egg,fish,mustard,shellfish"
"riboflavin, natural flavors, citric acid, natural colors, vitamin A, corn syrup, sugar, fructose",none
"corn syrup, glucose, yeast (for color), modified starch, yellow mustard, maltodextrin, folate, mono and diglycerides, mustard oil, beta carotene",mustard
"INGREDIENTS: cashew, celeriac, meringue, almond, milk fat, lupin flour, modified starch, celery salt, almond milk, carrageenan, sweet lupin, turmeric. CONTAINS dairy, lupin. MAY CONTAIN mustard, molluscs DUE TO SHARED EQUIPMENT","celery,dairy,egg,lupin,molluscs,mustard,tree_nuts"
