ingredient_text,allergens
"maltodextrin, soy lecithin, preservatives, potato starch, water, potassium chloride, folate, riboflavin",soy
"preservatives, mono and diglycerides, natural flavors, corn syrup, tapioca starch, baking powder (for texture), wheat gluten, wheat, wheat germ, potassium chloride, niacin, tahini","sesame,wheat"
"INGREDIENTS: tamari, cashew butter, salt, modified starch (as stabilizer), annatto, walnut, turmeric, hydrolyzed soy protein, anchovy","fish,soy,tree_nuts"
"INGREDIENTS: paprika extract, pine nut, maltodextrin, chestnut, seafood, glucose, corn syrup, egg powder, pasteurized egg, marzipan, shellfish, invert sugar, crab, egg white. CONTAINS shellfish. MAY CONTAIN peanut DUE TO SHARED EQUIPMENT","egg,peanut,shellfish,tree_nuts"
"sunflower oil, palm oil, rice flour, vegetable oil, invert sugar, (may be present: sesame, dairy), sodium sulfite, sodium metabisulfite, lecithin, riboflavin, glucose","dairy,sesame,sulphites"
"fructose, beta carotene, maltodextrin, baking powder, canola oil, natural colors",none
"potassium bisulfite, rice flour, baking powder, mollusc powder, wine preservative (sulfites), lecithin, white sesame, dried egg, oyster sauce, water (as preservative)","egg,molluscs,sesame,sulphites"
"lupini beans, lupin flour, natural flavors, goober peas, lupin seeds, lecithin, vitamin E, peanut protein, salt","lupin,peanut"
"INGREDIENTS: lactic acid, xanthan gum, prawn, palm oil (for color), sodium bicarbonate, sunflower oil (for texture), carrageenan, celery stalk. MAY CONTAIN mustard, molluscs, sesame DUE TO SHARED EQUIPMENT","celery,molluscs,mustard,sesame,shellfish"
"magnesium carbonate, sugar, water, baking powder (for color), dextrose, canola oil, natural flavors (for texture)",none
"preservatives, mono and diglycerides, maltodextrin, calcium carbonate",none
"INGREDIENTS: natural colors, sardine, gingelly oil, lupin seeds, til, celery extract, turmeric, carrageenan, oyster, salmon, folate, dextrose, celery root, modified starch, sweet lupin, periwinkle. CONTAINS celery, fish","celery,fish,lupin,molluscs,sesame"
"paprika extract, turmeric, sodium bicarbonate, fish sauce, dextrose, magnesium carbonate, potato starch, annatto",fish
"lecithin, annatto, fish extract, artificial flavors",fish
"modified starch, mollusc extract, snail, (may contain traces of molluscs, wheat), mono and diglycerides, annatto","molluscs,molluscs,wheat"
"artificial flavors, lactic acid (as preservative), potassium chloride, corn starch (for texture), paprika extract, modified starch, preservatives, vitamin D",none
"citric acid, maltodextrin, vitamin D, turmeric, calcium carbonate (for texture), annatto, magnesium carbonate",none
"vitamin D, glucose, edamame, artificial flavors, sesame seed, tempeh, black sesame, (may contain traces of sesame, sulphites), thiamine, turmeric, magnesium carbonate, sesame flour, dextrose","sesame,sesame,soy,sulphites"
"lactic acid (for color), rice flour (for color), corn syrup, thiamine, baking powder, mono and diglycerides",none
"peanut sauce, celery salt, treated with sulfites, milk powder, milk, fish, whey, carrageenan, wine preservative (sulfites), canola oil, sunflower oil, magnesium carbonate, modified starch (for texture), maltodextrin, vitamin E, citric acid","celery,dairy,fish,peanut,sulphites"
"egg protein, fructose, tapioca starch, mustard extract, hydrolyzed soy protein, maltodextrin, magnesium carbonate, edamame, lecithin, soy protein, milk protein, mustard seed","dairy,egg,mustard,soy"
"sunflower oil, lecithin, invert sugar, xanthan gum, natural flavors, soybean",soy
"INGREDIENTS: lecithin, beta carotene, mustard paste, preservatives, milk fat, mustard, mustard powder. CONTAINS dairy, mustard. MAY CONTAIN fish, egg, soy DUE TO SHARED EQUIPMENT","dairy,egg,fish,mustard,soy"
"corn syrup, sodium bisulfite, artificial flavors, periwinkle, mustard oil, dijon mustard, preserved with sulfites, mustard, celery powder, sulfur dioxide, dried egg, beta carotene","celery,egg,molluscs,mustard,sulphites"
"fructose, whelk, black sesame, vitamin D, tapioca starch, white sesame, gingelly oil","molluscs,sesame"
"INGREDIENTS: almond flour, modified starch, annatto, pine nut, calcium carbonate. CONTAINS tree_nuts",tree_nuts
"snail, rice flour, cashew, guar gum, glucose, baking powder, walnut","molluscs,tree_nuts"
"INGREDIENTS: sunflower oil, water, maltodextrin. MAY CONTAIN molluscs DUE TO SHARED EQUIPMENT",",molluscs"
"tapioca starch, artificial flavors (for color), riboflavin, preservatives (for texture)",none
"INGREDIENTS: palm oil, paprika extract, potato starch, tapioca starch, durum wheat, yeast, sesame protein, potassium bisulfite, cashew butter, arachis oil, pine nut, calcium carbonate, dried fruits with sulfites, potassium metabisulfite, invert sugar, rice flour, brazil nut, wheat germ, malt. MAY CONTAIN shellfish DUE TO SHARED EQUIPMENT","peanut,sesame,shellfish,sulphites,tree_nuts,wheat"
"sesame seed, sesame paste, glucose (as stabilizer), baking powder (as stabilizer), paprika extract, black sesame, magnesium carbonate",sesame
"carrageenan, baking powder (as preservative), seafood, sodium bisulfite, preservatives, riboflavin, shrimp paste, tapioca starch, potassium chloride, citric acid, wine preservative (sulfites), sugar","shellfish,sulphites"
"INGREDIENTS: vegetable oil, artificial flavors, canola oil, corn syrup (for color), guar gum (for color), yeast, carrageenan, shellfish extract. CONTAINS shellfish",shellfish
"egg powder, corn syrup, potato starch, crawfish, niacin, natural flavors, shellfish, sugar, modified starch, guar gum, corn starch","egg,shellfish"
"lecithin, vitamin E, paprika extract, artificial flavors, dextrose (for color), lactic acid, potassium chloride",none
"sweet lupin, wheat, (processed in a facility that also processes sulphites, sesame, shellfish), vitamin E, dried egg, guar gum (for texture), egg wash, sunflower oil, folate, rice flour, egg, vitamin A (as stabilizer)","egg,lupin,sesame,shellfish,sulphites,wheat"
"INGREDIENTS: mustard seed, calcium carbonate, edamame, glucose, riboflavin, mayonnaise, mustard paste, dried albumin, citric acid, (produced in a facility that handles fish), soya, mustard powder, egg lecithin. CONTAINS fish, egg, mustard, soy","egg,fish,mustard,soy"
"mollusc powder, sulfur dioxide, sulfites, yeast, turmeric, baking powder, sodium sulfite, citric acid, xanthan gum, natural flavors","molluscs,sulphites"
"INGREDIENTS: artificial flavors, calcium carbonate, sodium bicarbonate, walnut oil, mono and diglycerides, annatto (for color), vegetable oil, fructose. CONTAINS tree_nuts",tree_nuts
"INGREDIENTS: folate, peanut butter, invert sugar, tuna, potassium chloride, malt extract, peanut flour, modified starch, xanthan gum, anchovy, sodium bicarbonate, beta carotene, fructose, preserved with sulfites, bread crumbs, sardine, wheat bran. CONTAINS wheat, sulphites","fish,peanut,sulphites,wheat"
"fructose, sodium bicarbonate, salt, potato starch, tapioca starch, baking powder, palm oil",none
"black sesame, yeast, albumin, folate, hydrolyzed wheat protein, egg, tahini, dextrose, malt, (processed in a facility that also processes egg), modified starch (for color)","egg,egg,sesame,wheat"
"carrageenan, modified starch, natural colors, preservatives, corn syrup, potato starch, maltodextrin",none
"xanthan gum, sesame oil, mono and diglycerides, lactic acid (for color), cashew, walnut oil, salt, egg powder, white sesame, dried albumin, crab, sesame seed, mustard seed, lecithin, vitamin E, mayonnaise","egg,mustard,sesame,shellfish,tree_nuts"
"mustard extract, mustard powder, mustard oil, maltodextrin, lupine, folate (for texture), vitamin E, modified starch, niacin, sodium bicarbonate (as preservative)","lupin,mustard"
"baking powder, shrimp, fructose (as preservative), annatto, sodium bicarbonate, hydrolyzed wheat protein, dextrose, canola oil","shellfish,wheat"
"vegetable oil, (produced in a facility that handles dairy, tree_nuts), magnesium carbonate, til, mono and diglycerides, rice flour, glucose, baking powder, white sesame, natural colors, mustard extract","dairy,mustard,sesame,tree_nuts"
"mono and diglycerides, milk protein, whey, glucose (for color), vitamin D, thiamine, milk, palm oil, (may be present: soy, mustard), potassium chloride, citric acid, sunflower oil","dairy,mustard,soy"
"shellfish, sugar, shellfish extract, carrageenan, celery seeds, celery spice, vitamin E (for color), palm oil, magnesium carbonate, xanthan gum","celery,shellfish"
"water, niacin, fish sauce, beta carotene, yeast, fish protein, crayfish, tapioca starch, calcium carbonate, contains sulfites, modified starch (for texture), sardine, wine preservative (sulfites)","fish,shellfish,sulphites"
"vegetable oil, xanthan gum, riboflavin (as preservative), invert sugar (for texture), sodium bicarbonate, pasteurized egg, albumin, mustard, scallop, lupine, chestnut, annatto, niacin (as stabilizer)","egg,lupin,molluscs,mustard,tree_nuts"
"INGREDIENTS: celery extract, lactic acid, celery leaves, periwinkle, natural flavors, natto, maltodextrin, celery spice, artificial flavors, niacin, squid, guar gum. CONTAINS molluscs, soy, celery. MAY CONTAIN fish, soy DUE TO SHARED EQUIPMENT","celery,fish,molluscs,soy"
"potato starch, yellow mustard, white sesame, preservatives, egg powder, sunflower oil, paprika extract, egg yolk, corn syrup, vegetable oil, mustard seed, til, natural colors, sesame flour, sodium bicarbonate","egg,mustard,sesame"
"niacin, abalone, mussel, mono and diglycerides, paprika extract, squid",molluscs
"INGREDIENTS: sesame paste, corn syrup, lupini beans, canola oil, yeast, xanthan gum, vitamin A, lupin, sodium bicarbonate, maltodextrin, gingelly oil. CONTAINS lupin","lupin,sesame"
"modified starch, lecithin, corn syrup, canola oil, walnut oil, pecan, xanthan gum, celery, clam, celery seasoning, dextrose, lupin, cashew, celery seeds","celery,lupin,molluscs,tree_nuts"
"baking powder, annatto, paprika extract, artificial flavors",none
"INGREDIENTS: palm oil, vitamin E, thiamine (as stabilizer), canola oil, baking powder, water",none
"mono and diglycerides, magnesium carbonate, seitan, ghee, whole wheat flour, lupin concentrate, fructose, prawn, beta carotene, sweet lupin, almond, cheese, carrageenan, water","dairy,lupin,shellfish,tree_nuts,wheat"
"wine preservative (sulfites), potassium chloride, mono and diglycerides, mustard flour, corn syrup, dijon mustard, salt","mustard,sulphites"
"potato starch, milk powder, lupin bean powder, annatto, whey, maltodextrin, carrageenan, paprika extract, (may contain traces of molluscs, wheat), shellfish, bread crumbs, sweet lupin, edamame, crab, lupine, folate, hydrolyzed wheat protein, dextrose, yeast (for color)","dairy,lupin,molluscs,shellfish,soy,wheat,wheat"
"INGREDIENTS: vitamin A (as stabilizer), lecithin, annatto, couscous, malt extract. CONTAINS wheat",wheat
"INGREDIENTS: vitamin A, meringue, yeast, modified starch, folate, natural colors, egg protein, egg wash, lobster, carrageenan","egg,shellfish"
"natural flavors, fructose, vitamin D (for texture), turmeric",none
"guar gum, folate, semolina, magnesium carbonate, potato starch, mono and diglycerides, glucose, dextrose, potassium chloride",wheat
"modified starch (for color), almond, almond milk, dextrose, glucose, rice flour, natural colors, tapioca starch",tree_nuts
"INGREDIENTS: dijon mustard, crab, lupin concentrate, niacin (as stabilizer), lupin, white sesame, peanut butter, ground peanuts, canola oil, mono and diglycerides, sweet lupin, krill, sunflower oil (for texture), glucose, sodium bicarbonate, mustard, mustard paste, carrageenan, til, corn syrup. CONTAINS lupin, sesame, shellfish, peanut, mustard","lupin,mustard,peanut,sesame,shellfish"
"yeast, water, niacin (as stabilizer), rice flour, folate, natural flavors",none
"canola oil, peanut, tapioca starch, lactic acid (as preservative), dextrose",peanut
"xanthan gum, vegetable oil, rice flour, modified starch (as preservative), mono and diglycerides, natural colors, glucose (as preservative), sodium bisulfite",sulphites
"INGREDIENTS: citric acid, lupin bean powder, sunflower oil, contains sulfites, artificial flavors. CONTAINS sulphites, lupin. MAY CONTAIN sulphites DUE TO SHARED EQUIPMENT","lupin,sulphites"
"vitamin E, tahini, potassium chloride, sesame seed, ground nut oil, peanut, black sesame, peanut butter, beta carotene, natural colors, magnesium carbonate","peanut,sesame"
"meringue, yellow mustard, vitamin A, paprika extract, egg powder, palm oil, salt","egg,mustard"
"INGREDIENTS: ghee, natural flavors (as preservative), celery seeds, dairy cream, peanut oil, abalone, mono and diglycerides, fish paste, celery seasoning, scallop, turmeric. CONTAINS celery, peanut. MAY CONTAIN fish DUE TO SHARED EQUIPMENT","celery,dairy,fish,molluscs,peanut"
"carrageenan, albumin, vitamin A, dried egg, dextrose, lecithin, pasteurized egg",egg
"surimi, mackerel, vegetable oil, fish sauce, egg protein, albumin, lactic acid, riboflavin","egg,fish"
"INGREDIENTS: annatto, lupine, dextrose, baking powder, skimmed milk powder, celery powder, vegetable oil","celery,dairy,lupin"
"thiamine, modified starch, sodium bicarbonate (as stabilizer), ground nut oil, magnesium carbonate, semolina","peanut,wheat"
"calcium carbonate, dextrose, peanut butter, paprika extract, fructose",peanut
"tamari, soy flour, vitamin E, soya, magnesium carbonate, lactic acid, potato starch, natural colors",soy
"annatto, tempeh, mustard extract, soya, miso, lecithin, modified starch, vegetable oil, preservatives (as stabilizer), beta carotene","mustard,soy"
"natural flavors, canola oil, potassium chloride, calcium carbonate, beta carotene, invert sugar, mono and diglycerides",none
"magnesium carbonate, carrageenan, glucose, rice flour (for color), tapioca starch, calcium carbonate (for texture), annatto",none
"water, walnut oil, mustard extract, dairy cream, lactose, invert sugar, mustard oil, natural colors (as stabilizer), mustard, magnesium carbonate","dairy,mustard,tree_nuts"
"lactic acid (as stabilizer), sodium bisulfite, fructose, artificial flavors",sulphites
"vegetable oil, cod, sodium sulfite, fructose, sulfites, vitamin E, natural flavors, fish paste, carrageenan, thiamine, mono and diglycerides, water","fish,sulphites"
"vitamin E, modified starch (as stabilizer), guar gum",none
"palm oil (as preservative), guar gum, potassium chloride, calcium carbonate, xanthan gum, mono and diglycerides, edamame, modified starch, soy protein, rice flour",soy
"soybean, sunflower oil, paprika extract, magnesium carbonate, lecithin, soy sauce",soy
"INGREDIENTS: natural colors, sugar, niacin, water, magnesium carbonate, tofu, paprika extract. CONTAINS soy",soy
"thiamine, lactic acid, lupin protein, rice flour, potato starch, paprika extract, prawn, vitamin E, sweet lupin, natural flavors","lupin,shellfish"
"INGREDIENTS: mustard paste, glucose, fructose, mustard, mustard flour, carrageenan, artificial flavors, paprika extract, vitamin A, baking powder, preservatives",mustard
"INGREDIENTS: mono and diglycerides, niacin, paprika extract. MAY CONTAIN fish, lupin DUE TO SHARED EQUIPMENT",",fish,lupin"
"dextrose, sugar, natural colors, yeast (for texture)",none
"INGREDIENTS: soy protein, soya, carrageenan, shellfish, sugar, lecithin, yeast, lobster, citric acid, turmeric, corn starch, beta carotene, tamari","shellfish,soy"
"anchovy, yeast, glucose, lecithin, citric acid, fish oil, fish powder, water, annatto",fish
"langoustine, corn starch, preservatives, crab, crawfish, (processed in a facility that also processes dairy), calcium carbonate","dairy,shellfish"
"natural colors, water, celery juice, celery stalk, baking powder, magnesium carbonate",celery
"baking powder, beta carotene, surimi, fish sauce, ghee, rice flour, sesame protein, lactic acid, glucose, vitamin A (as stabilizer), gingelly oil, invert sugar, natural flavors","dairy,fish,sesame"
"sulfur dioxide, milk powder, wine preservative (sulfites), whey, (processed in a facility that also processes molluscs, mustard, soy), citric acid, sodium bisulfite, fructose, surimi, riboflavin","dairy,fish,molluscs,mustard,soy,sulphites"
"corn syrup, vitamin E, goober peas, palm oil, peanut flour, citric acid, lactic acid, mono and diglycerides, sugar, peanut paste",peanut
"tahini, sugar, lactic acid, milk protein isolate, guar gum, sodium sulfite, dried albumin, sesame, egg white, sesame paste, niacin, sulfites, potassium chloride, baking powder, sodium bicarbonate, potassium bisulfite, turmeric, whey, albumin","dairy,egg,sesame,sulphites"
"sodium bicarbonate, folate, salt, paprika extract, xanthan gum",none
"corn starch, vitamin D, egg white, thiamine, egg, lupin protein, guar gum, egg yolk, mono and diglycerides, potato starch (for texture)","egg,lupin"
"INGREDIENTS: corn starch, (produced in a facility that handles lupin, molluscs), cheese, dextrose, milk protein, artificial flavors, natural flavors, xanthan gum, guar gum (for color), lecithin (as preservative), baking powder","dairy,lupin,molluscs"
"tapioca starch, magnesium carbonate, scallop, folate, clam, thiamine",molluscs
"turmeric, citric acid, riboflavin, guar gum, sugar",none
"INGREDIENTS: annatto, vitamin E (for color), corn syrup, shellfish extract, seafood, yeast, riboflavin, thiamine, maltodextrin, potassium chloride. MAY CONTAIN egg DUE TO SHARED EQUIPMENT","egg,shellfish"
"INGREDIENTS: rice flour, modified starch, krill, arachis oil, sulfites, natural colors, crayfish, vegetable oil. CONTAINS peanut, sulphites","peanut,shellfish,sulphites"
"INGREDIENTS: riboflavin, textured vegetable protein, dried fruits with sulfites, annatto, hydrolyzed soy protein, salt, crawfish, soy, guar gum, peanut paste, goober peas, sodium sulfite. CONTAINS sulphites, soy, shellfish. MAY CONTAIN wheat, fish DUE TO SHARED EQUIPMENT","fish,peanut,shellfish,soy,sulphites,wheat"
"INGREDIENTS: baking powder, sugar, canola oil, modified starch, beta carotene",none
"mono and diglycerides, water, guar gum, folate, sunflower oil, shellfish, lobster, dextrose, fructose, citric acid (as stabilizer)",shellfish
"mollusc extract, dextrose, baking powder, beta carotene, walnut, mollusc powder, guar gum, pecan, til, squid","molluscs,sesame,tree_nuts"
"fructose, corn starch, potassium chloride, potassium bisulfite, potato starch, wine preservative (sulfites), preserved with sulfites, celery stalk, celery seasoning, invert sugar, celery leaves, sodium bicarbonate","celery,sulphites"
"carrageenan, celery powder, lupini beans, hydrolyzed soy protein, guar gum, shrimp paste, lupin flour, celery stalk, lupin protein, celeriac, canola oil, vitamin D","celery,lupin,shellfish,soy"
"tapioca starch, corn syrup, vitamin D, magnesium carbonate, vegetable oil, calcium carbonate, peanut protein, peanut butter, sesame seed, sesame, thiamine, peanut sauce","peanut,sesame"
"INGREDIENTS: magnesium carbonate, snail, paneer, cashew, thiamine, curd, citric acid, clam, milk solids, calamari, lecithin. MAY CONTAIN tree_nuts DUE TO SHARED EQUIPMENT","dairy,molluscs,tree_nuts"
"carrageenan, natural colors (as stabilizer), palm oil, sulfur dioxide, mono and diglycerides",sulphites
"INGREDIENTS: vegetable oil, mustard flour, guar gum, yeast (for texture), rice flour, prawn, glucose, annatto, dijon mustard, calcium carbonate, riboflavin, shellfish extract, hazelnut, mustard extract, almond, pistachio. CONTAINS mustard, shellfish, tree_nuts","mustard,shellfish,tree_nuts"
"natural colors, sodium bicarbonate, natto, modified starch, vitamin E, dextrin, textured vegetable protein, water, annatto, casein","dairy,soy,wheat"
"guar gum, niacin, annatto, arachis oil, ground peanuts, beer nuts, preservatives",peanut
"maltodextrin, niacin, natural colors, yeast, (may be present: sesame, fish), tapioca starch, palm oil, surimi, citric acid, salmon, gingelly oil, tahini","fish,fish,sesame,sesame"
"INGREDIENTS: folate (for color), sunflower oil, paprika extract, annatto, crab, guar gum, water. CONTAINS shellfish. MAY CONTAIN tree_nuts, sulphites, shellfish DUE TO SHARED EQUIPMENT","shellfish,sulphites,tree_nuts"
"INGREDIENTS: arachis oil, mustard flour, corn starch, monkey nuts, peanut flour, mono and diglycerides, mustard paste, tapioca starch, vitamin A. CONTAINS peanut","mustard,peanut"
"INGREDIENTS: paprika extract, palm oil (for color), (processed in a facility that also processes lupin, sesame, mustard), rice flour, baking powder (for texture), sodium caseinate, yeast, tapioca starch, folate (for color), paneer, sugar. CONTAINS sesame","dairy,lupin,mustard,sesame"
"riboflavin (as stabilizer), palm oil, chestnut, almond, baking powder, water, salt, folate, yeast, thiamine, macadamia, tamari, edamame","soy,tree_nuts"
"INGREDIENTS: clam, turmeric, mono and diglycerides, invert sugar, magnesium carbonate, chestnut, potassium chloride (as preservative), salt, albumin, mussel, abalone, xanthan gum, preservatives","egg,molluscs,tree_nuts"
"INGREDIENTS: baking powder, lactic acid, modified starch, vitamin A, vegetable oil",none
"INGREDIENTS: calcium carbonate, citric acid, folate",none
"riboflavin, xanthan gum, natural flavors, preservatives, palm oil, dextrose, sunflower oil",none
"preservatives, palm oil, folate, mono and diglycerides, lactic acid, gingelly oil, sesame flour, niacin",sesame
"dextrose, modified starch, invert sugar, glucose",none
"glucose, fructose (as preservative), vitamin A, magnesium carbonate, potato starch, lactic acid, celery juice, celery leaves, palm oil",celery
"mustard, celery root, water, oyster, ghee, skimmed milk powder, dextrose, maltodextrin, octopus, fructose (for color), oyster sauce, sugar, sunflower oil","celery,dairy,molluscs,mustard"
"carrageenan, sunflower oil, vitamin A (for texture)",none
"riboflavin, baking powder, sugar, vitamin E",none
"niacin, carrageenan, potato starch, turmeric, mono and diglycerides, water",none
"citric acid, lactic acid, xanthan gum, potassium chloride, vitamin D, (may be present: sulphites, wheat)","sulphites,wheat"
"INGREDIENTS: modified food starch, mussel, durum wheat, sunflower oil, palm oil, yeast, turmeric, oyster, annatto (as preservative), xanthan gum, lobster. CONTAINS molluscs. MAY CONTAIN lupin, sesame DUE TO SHARED EQUIPMENT","lupin,molluscs,sesame,shellfish,wheat"
"INGREDIENTS: water, tapioca starch, calcium carbonate, beta carotene, corn syrup, dextrose, lactic acid",none
"INGREDIENTS: textured vegetable protein, baking powder (for color), turmeric (as stabilizer), citric acid, canola oil (as preservative), dextrose (for color), invert sugar, corn starch, hydrolyzed soy protein, lecithin. CONTAINS soy",soy
"natural colors, thiamine, carrageenan",none
"lecithin, sugar, riboflavin, vitamin E (as stabilizer), magnesium carbonate, mono and diglycerides",none
"INGREDIENTS: potato starch, sugar (as preservative), dextrose, yellow mustard, annatto, mustard flour, palm oil, natural flavors, water (for color), niacin. CONTAINS mustard",mustard
"INGREDIENTS: water, natural flavors, tamari, sunflower oil, magnesium carbonate, (produced in a facility that handles molluscs, dairy), mono and diglycerides, corn starch. CONTAINS soy, dairy. MAY CONTAIN peanut, celery, soy DUE TO SHARED EQUIPMENT","celery,dairy,molluscs,peanut,soy"
"INGREDIENTS: riboflavin (for color), thiamine, natural flavors, rice flour, soy sauce, sunflower oil (for texture), soy flour, salt, modified starch",soy
"INGREDIENTS: rice flour, fructose, carrageenan, riboflavin, mustard seed, mustard extract, dextrose, potato starch (as stabilizer), vitamin D, tapioca starch. CONTAINS mustard. MAY CONTAIN celery, mustard DUE TO SHARED EQUIPMENT","celery,mustard"
"INGREDIENTS: guar gum, palm oil, miso, vitamin D, turmeric (as stabilizer), niacin, maltodextrin, soy sauce. CONTAINS soy",soy
"INGREDIENTS: milk powder, peanut, ground peanuts, natural flavors, cashew, baking powder, mayonnaise, ghee, casein, pasteurized egg, preservatives. CONTAINS egg, dairy","dairy,egg,peanut,tree_nuts"
"artificial flavors, tapioca starch, maltodextrin, mono and diglycerides, sodium bicarbonate, thiamine (for texture), folate, sugar (for texture)",none
"INGREDIENTS: xanthan gum, corn syrup (as stabilizer), carrageenan, glucose, fructose",none
"INGREDIENTS: textured vegetable protein, glucose, soy sauce, lecithin, (manufactured on equipment that also processes sesame, tree_nuts), sugar, miso, canola oil, yeast. CONTAINS sesame, soy, tree_nuts","sesame,soy,tree_nuts"
"INGREDIENTS: lupini beans, paprika extract, lactic acid, natural flavors, beta carotene, guar gum, riboflavin. CONTAINS lupin. MAY CONTAIN shellfish, celery, dairy DUE TO SHARED EQUIPMENT","celery,dairy,lupin,shellfish"
"INGREDIENTS: vitamin E, artificial flavors, calcium carbonate, fish paste, lecithin, fish extract. CONTAINS fish",fish
"INGREDIENTS: tahini, turmeric, corn syrup, fructose, annatto, xanthan gum, glucose, paprika extract. CONTAINS sesame",sesame
"natural flavors, modified starch, textured vegetable protein, soy protein, potassium chloride, soy flour, corn starch",soy
"citric acid, magnesium carbonate (for texture), yeast, salt, xanthan gum, (manufactured on equipment that also processes sesame, mustard), lactic acid, rice flour, lupin","lupin,mustard,sesame"
"INGREDIENTS: dextrose (as preservative), potassium chloride, guar gum, canola oil, vegetable oil, glucose, magnesium carbonate",none
"INGREDIENTS: ground nut oil, calcium carbonate, peanut flour, magnesium carbonate, tapioca starch, goober peas. MAY CONTAIN soy, tree_nuts, sesame DUE TO SHARED EQUIPMENT","peanut,sesame,soy,tree_nuts"
"artificial flavors, sodium bicarbonate, beta carotene, vitamin D, annatto",none
"skimmed milk powder, milk, black sesame, tapioca starch, cashew butter, whole wheat flour, walnut oil, milk solids, pecan, tahini, sunflower oil, clam, folate, calamari, durum wheat","dairy,molluscs,sesame,tree_nuts,wheat"
